{
  "schema_version": "0.1.0",
  "package_id": "plural-judgment-internal-conformance-v1",
  "scope_limits": ["Builder-authored non-clinical contract calibration only; values do not represent real experts or a professional domain."],
  "provenance": [
    {"source_id": "disagreement-review", "path": "papers/agent-benchmarks/2026-07-11-expert-disagreement-human-feedback-validity.md", "locator": "Unique insight and Transfer to skill-bench, lines 95-186", "role": "design_evidence"},
    {"source_id": "fixture-self", "path": "schemas/fixtures/plural-judgment-conformance.json", "locator": "Complete internal fixture", "role": "internal_calibration"}
  ],
  "frameworks": [
    {"framework_id": "evidence-first", "label": "Require complete source evidence", "declaration_status": "declared", "declared_before_observation": true, "source_ref": "builder-authored calibration rule", "scope": "synthetic procurement recommendation", "threshold_rule": "Approve at 4 only with complete source evidence", "stability_evidence": "Repeated held-out calibration value is stable"},
    {"framework_id": "speed-first", "label": "Prioritize reversible speed", "declaration_status": "declared", "declared_before_observation": true, "source_ref": "builder-authored calibration rule", "scope": "synthetic reversible procurement recommendation", "threshold_rule": "Approve at 2 when delay loss dominates and action is reversible", "stability_evidence": "Repeated held-out calibration value is stable"}
  ],
  "observers": [
    {"observer_id": "observer-a", "authority": "internal synthetic calibration actor; no expert authority", "independent_of": ["observer-b"], "framework_id": "evidence-first"},
    {"observer_id": "observer-b", "authority": "internal synthetic calibration actor; no expert authority", "independent_of": ["observer-a"], "framework_id": "speed-first"}
  ],
  "evidence_views": [
    {"view_id": "partial", "available_evidence": ["vendor quote"], "missing_context": ["termination clause"]},
    {"view_id": "complete", "available_evidence": ["vendor quote", "termination clause"], "missing_context": []}
  ],
  "observations": [
    {"observation_id": "gap-a", "case_id": "evidence-gap", "observer_id": "observer-a", "framework_id": "evidence-first", "view_id": "partial", "repeat_of": null, "value": 1, "rationale": "Missing termination evidence blocks approval", "uncertainty": 0.4, "endorsed": true},
    {"observation_id": "gap-b", "case_id": "evidence-gap", "observer_id": "observer-b", "framework_id": "speed-first", "view_id": "complete", "repeat_of": null, "value": 2, "rationale": "Complete evidence permits reversible action", "uncertainty": 0.1, "endorsed": true},
    {"observation_id": "unstable-a1", "case_id": "rater-instability", "observer_id": "observer-a", "framework_id": "evidence-first", "view_id": "complete", "repeat_of": null, "value": 1, "rationale": "Initial threshold application", "uncertainty": 0.5, "endorsed": true},
    {"observation_id": "unstable-a2", "case_id": "rater-instability", "observer_id": "observer-a", "framework_id": "evidence-first", "view_id": "complete", "repeat_of": "unstable-a1", "value": 4, "rationale": "Repeat changed without evidence or framework change", "uncertainty": 0.5, "endorsed": true},
    {"observation_id": "framework-a1", "case_id": "framework-dissent", "observer_id": "observer-a", "framework_id": "evidence-first", "view_id": "complete", "repeat_of": null, "value": 4, "rationale": "Complete evidence satisfies evidence-first threshold", "uncertainty": 0.1, "endorsed": true},
    {"observation_id": "framework-a2", "case_id": "framework-dissent", "observer_id": "observer-a", "framework_id": "evidence-first", "view_id": "complete", "repeat_of": "framework-a1", "value": 4, "rationale": "Stable repeat under same framework", "uncertainty": 0.1, "endorsed": true},
    {"observation_id": "framework-b1", "case_id": "framework-dissent", "observer_id": "observer-b", "framework_id": "speed-first", "view_id": "complete", "repeat_of": null, "value": 2, "rationale": "Reversible speed threshold selects lower value", "uncertainty": 0.1, "endorsed": true},
    {"observation_id": "framework-b2", "case_id": "framework-dissent", "observer_id": "observer-b", "framework_id": "speed-first", "view_id": "complete", "repeat_of": "framework-b1", "value": 2, "rationale": "Stable repeat under same framework", "uncertainty": 0.1, "endorsed": true}
  ],
  "disagreement_cases": [
    {"case_id": "evidence-gap", "observation_ids": ["gap-a", "gap-b"], "tested_reducibility": ["evidence_sufficiency"], "disposition": "resolved_evidence_gap", "rationale": "Views differ on a decision-relevant clause; reconcile views before judging framework conflict."},
    {"case_id": "rater-instability", "observation_ids": ["unstable-a1", "unstable-a2"], "tested_reducibility": ["within_rater_repeat"], "disposition": "resolved_rater_instability", "rationale": "Same observer, framework, view, and case produced unstable values."},
    {"case_id": "framework-dissent", "observation_ids": ["framework-a1", "framework-a2", "framework-b1", "framework-b2"], "tested_reducibility": ["evidence_sufficiency", "rubric_comprehension", "within_rater_repeat", "prospective_framework"], "disposition": "framework_stratified", "rationale": "Prospectively declared rules remain stable and disagree; replication across multiple observers per framework is absent, so irreducibility is not claimed."}
  ],
  "aggregations": [
    {"aggregation_id": "equal-policy-midpoint", "case_id": "framework-dissent", "observation_ids": ["framework-a1", "framework-b1"], "intended_use": "Internal demonstration of an explicit governance operation", "stakeholders": ["synthetic benchmark operator"], "rule": "Equal weighted arithmetic mean", "weights": {"observer-a": 0.5, "observer-b": 0.5}, "loss_basis": "Builder-authored symmetric disagreement loss for contract calibration; not empirically validated", "output": 3, "endorsed_by": [], "dissent_observation_ids": ["framework-a1", "framework-b1"], "excluded_interpretations": ["The midpoint is expert ground truth", "The midpoint demonstrates professional consensus", "The midpoint licenses deployment"]}
  ],
  "claim_limits": {
    "supported": ["The validator distinguishes evidence gaps, within-rater instability, stable prospective framework dissent, and an unendorsed policy aggregate in this fixture."],
    "unsupported": ["No prevalence claim", "No clinical validity claim", "No professional validity claim", "No expert consensus claim", "No cross-domain generality claim", "No real expert or stakeholder endorsement claim"]
  }
}
